text,classification
note need singleton thing like work probabl good idea speed cach singl instanc seem technic incorrect consid declaringinterpret could differ circumst case child interpret run sourc eval command howev effect main interpret execut script one involv callback java know corner case child interpret would first use refer namespac would even caus problem could experi find necessari could cach per interpret basi weak refer might also look skip child interpret go parent declar interpret wed sure get top interpret,code/design_debt
resolv relat class type static field inner class,code/design_debt
regexp length implement hack dont understand what go back watch mtv,code/design_debt
optim classofstaticmethod set alreadi determin static method invoc note mayb factor path clean,code/design_debt
probabl get use object type,code/design_debt
window jdk workaround,code/design_debt
listen prioriti thing bad hack,code/design_debt
doesnt look pretti mode line probabl split seper componentsstr,code/design_debt
stupid mislead path use anywher except line done continu either hang forc duplic insid buffer null add final claus decid one wors,code/design_debt
workaround hang match zerowidth sure better way handl,code/design_debt
xxx magic number,code/design_debt
window path form list last work directori drive list root drive must use howev vfs browser friend strip trail path separ various reason work around add drive letter path window,code/design_debt
unix set permiss port file broken unic give everyon read access user home dir peopl cant see port file henc send arbitriari beanshel code way nasti,code/design_debt
call fulli load action set,code/design_debt
broken eclips workaround febuari 2004,code/design_debt
note broken find public less specif method nonpubl specif one method need rewritten elimin findaccessiblemethod implement findmostspecificmethod use publicon flag findmostspecificmethod also oper two pass give standard java assign match prioriti extend bsh type match,code/design_debt
xxx hardcod,code/design_debt
interv oper reinterv renobkbrac reinterv renobkbrac open question proper interpret start string,code/design_debt
xxx realli belong,code/design_debt
need save everi possibl point number clone invoc realli killer perform nonstingi repeat oper open suggest,code/design_debt
note realli throw nosuchfieldexcept need chang relat signatur code,code/design_debt
split method constructor regular method list,code/design_debt
need add static block,requirement_debt
output stream compress bzip2 format without file header char anoth stream todo updat bzip2 101 author hrefmailtokeironaftexswcomkeiron liddlea,requirement_debt
pars xml declar pre xmldecl ltxml versioninfo encodingdecl sddecl versioninfo version sddecl standalon yes standalon yes encodingdecl encod qencod pre p80 also signific pthe codeltxmlcod whitespac alreadi read ptodo valid valu standalon see parsetextdecl see checkencod,requirement_debt
implement recurs getclassimpl,requirement_debt
need format check,requirement_debt
need calcul fudg,requirement_debt
todo also check reganchorindex anchor,requirement_debt
skip header byte mayb check theyr valid,requirement_debt
debug util static reachabl code doesnt necessarili interpret refer trace util futur may want allow debugtrac turn per interpret basi case well need use parent refer way determin scope command turn,requirement_debt
pars elementcont model element choic seq cps choic ctokplus ctok ctokplus cps cps ctok cps cps seq stok stok stok cps cps note open alreadi read todo paramet entiti boundari care,requirement_debt
need calcul fudg,requirement_debt
convent may chang,requirement_debt
pars attribut type atttyp stringtyp tokenizedtyp enumeratedtyp stringtyp cdata tokenizedtyp idref idref entiti entiti nmtoken nmtoken enumeratedtyp notationtyp enumer todo valid type,requirement_debt
need calcul fudg,requirement_debt
todo test surrog valu legal,test_debt
getnam test,test_debt
todo liter test retokennewlin unfortun may singl charact,test_debt
may negat,code/design_debt
todo implement,code/design_debt
todo subplot area need move plot plot state,code/design_debt
todo shift block bottom,code/design_debt
todo might good idea keep refer color specifi setpaint setcolor rather creat new object everi time getpaint call,code/design_debt
todo ignor height constraint,code/design_debt
first determin size chart render area todo workout inset swt,code/design_debt
todo implement proper,code/design_debt
todo must wrong,code/design_debt
todo didnt check width yet,code/design_debt
hack ensur newli creat awt font render height swt one,code/design_debt
todo shift block right half,code/design_debt
fixm need local well timezon,code/design_debt
todo shift block right,code/design_debt
need updat crosshair valu,code/design_debt
todo find better local key,code/design_debt
todo attribut transfer render state,code/design_debt
fixm implement low prioriti,code/design_debt
fixm xyitemrender interfac doesnt specifi getannot method,code/design_debt
defer argument check,code/design_debt
calcul adjust data area take account effect assum render effect bit ugli hack,code/design_debt
todo add constructor combin number date formatt,code/design_debt
defer argument check,code/design_debt
todo move plot state,code/design_debt
tweak notifi flag plot one notif happen even though updat multipl axe,code/design_debt
defer argument check,code/design_debt
fixm realli assert valu,code/design_debt
annot work xyplot see possibl make contourplot subclass xyplot,code/design_debt
fixm realli assert valu,code/design_debt
need updat crosshair valu,code/design_debt
strict necessari sinc render set parent plot use,code/design_debt
need updat crosshair valu,code/design_debt
todo complet,code/design_debt
todo implement,code/design_debt
defer argument check,code/design_debt
todo implement,code/design_debt
defer argument check,code/design_debt
todo implement,code/design_debt
need updat crosshair valu,code/design_debt
todo fix output flag set true,code/design_debt
todo ignor height constraint,code/design_debt
todo move plot state,code/design_debt
defer argument check,code/design_debt
fixm code mean possibl use one domain axi combin plot,code/design_debt
tweak notifi flag plot one notif happen even though updat multipl axe,code/design_debt
strict necessari sinc render set parent plot use,code/design_debt
tweak notifi flag plot one notif happen even though updat multipl axe,code/design_debt
end workaround,code/design_debt
defer argument check,code/design_debt
todo could chang itemfillpaint backward compat might requir usefillpaint flag,code/design_debt
redraw trigger anoth chang event,code/design_debt
unus parent,code/design_debt
todo attribut transfer render state,code/design_debt
defer argument check,code/design_debt
todo jfreechart 120 put method categoryitemrender interfac,code/design_debt
todo rotat imag drawn horizont orient,code/design_debt
defer argument check,code/design_debt
defer argument check,code/design_debt
defer argument check,code/design_debt
defer argument check,code/design_debt
todo implement proper,code/design_debt
fixm generat seri chang event,code/design_debt
defer argument check,code/design_debt
defer argument check,code/design_debt
defer argument check,code/design_debt
defer argument check,code/design_debt
fixm realli assert valu,code/design_debt
defer argument check,code/design_debt
redraw trigger anoth chang event,code/design_debt
creat entiti fixm method defin,code/design_debt
redraw trigger anoth chang event,code/design_debt
defer argument check,code/design_debt
fixm render interfac doesnt drawdomainlin method reli render subclass abstractxyitemrender lame,code/design_debt
defer argument check,code/design_debt
fixm attribut use deprec,code/design_debt
todo code event inform chang dataset could make recalcul interv effici case instanc chang updat yvalu xinterv doesnt need updat,code/design_debt
tweak notifi flag plot one notif happen even though updat multipl axe,code/design_debt
defer argument check,code/design_debt
method want isnt categoryitemrender interfac,code/design_debt
defer argument check,code/design_debt
defer argument check,code/design_debt
fixm valu null next line,code/design_debt
todo need move render state,code/design_debt
todo implement method proper,code/design_debt
hack ensur newli creat swt font render height awt one,code/design_debt
unus parent,code/design_debt
defer argument check,code/design_debt
unus must return someth,code/design_debt
redraw trigger anoth chang event,code/design_debt
fixm perhap clone data list,code/design_debt
tweak notifi flag plot one notif happen even though updat multipl axe,code/design_debt
defer argument check,code/design_debt
defer argument check,code/design_debt
render valu percentag need calcul total current item unfortun end repeat calcul time strict necessari hope ill come back find way add total render state problem implicit assum dataset negat valuesperhap fix,code/design_debt
defer argument check,code/design_debt
note would nice precalcul per seri,code/design_debt
assum paint instanc implement equal hashcodeof cours might true,code/design_debt
fixm use field,code/design_debt
defer argument check,code/design_debt
attribut immut return superclon fixm fact generat immut clone necessari,code/design_debt
fixm realli assert valu,code/design_debt
here quirk api defin term plain timeperiod cannot make use timezon local specifi constructorso time zone peg period instanceof regulartimeperiod,code/design_debt
handl specif plot type yes know realli ugli code manual updat time new plot type ad written someth much cooler didnt neither anyon els,code/design_debt
todo urlencod,code/design_debt
creat entiti fixm method defin,code/design_debt
todo revert svn revis 2469 jfreechart 1016 multiplegradientpaint jdk issu todo chang visibl darker method except darkerpaint privat,code/design_debt
todo replac getsiz getbound,code/design_debt
todo check threshold,code/design_debt
fixm add setbaseitemurlgeneratorcategoryurlgener boolean,code/design_debt
unus parent,code/design_debt
fixm add setseriesitemurlgeneratorint categoryurlgener boolean,code/design_debt
defer argument check,code/design_debt
defer argument check,code/design_debt
handl special case yes ugli code alert,code/design_debt
fixm probabl make sens alloc array 256 color lazili popul array,code/design_debt
todo need fetch localis resourc,code/design_debt
defer argument check,code/design_debt
defer argument check,code/design_debt
fixm getvalueformat method,code/design_debt
defer argument check,code/design_debt
could probabl littl faster search indic simultan ill look later seem like matter,code/design_debt
todo complet,code/design_debt
fixm attribut never use deprec,code/design_debt
defer argument check,code/design_debt
fixm realli assert valu,code/design_debt
defer argument check,code/design_debt
fixm clone attribut string null,code/design_debt
todo implement method proper,code/design_debt
tweak notifi flag plot one notif happen even though updat multipl axe,code/design_debt
defer argument check,code/design_debt
defer argument check,code/design_debt
report,code/design_debt
defer argument check,code/design_debt
defer argument check,code/design_debt
tweak notifi flag plot one notif happen even though updat multipl axe,code/design_debt
defer argument check,code/design_debt
tweak notifi flag plot one notif happen even though updat multipl axe,code/design_debt
may obsolet use anywher,code/design_debt
tweak notifi flag plot one notif happen even though updat multipl axe,code/design_debt
todo good idea,code/design_debt
defer argument check,code/design_debt
kludg make everyth work row return,code/design_debt
tweak notifi flag plot one notif happen even though updat multipl axe,code/design_debt
report,code/design_debt
todo shift block half,code/design_debt
todo good idea,code/design_debt
fixm better ask render instead datasetutil,code/design_debt
defer argument check,code/design_debt
todo implement entiti annot,code/design_debt
defer argument check,code/design_debt
defer argument check,code/design_debt
defer argument check,code/design_debt
todo need move render state,code/design_debt
defer argument check,code/design_debt
need improv,code/design_debt
defer argument check,code/design_debt
use plot,code/design_debt
defer argument check,code/design_debt
fixm attribut never use deprec,code/design_debt
fixm need local well timezon,code/design_debt
todo implement proper,code/design_debt
defer argument check,code/design_debt
todo jfreechart 120 method shapeutil class,code/design_debt
defer argument check,code/design_debt
well use method interfac doesnt paint stroke set,code/design_debt
defer argument check,code/design_debt
defer argument check,code/design_debt
defer argument check,code/design_debt
defer argument check,code/design_debt
defer argument check,code/design_debt
defer argument check,code/design_debt
defer argument check,code/design_debt
defer argument check,code/design_debt
todo might good idea keep refer color specifi setpaint setcolor rather creat new object everi time getpaint call,code/design_debt
defer argument check,code/design_debt
fixm check isnt alreadi seri key,code/design_debt
know bad creat object better idea,code/design_debt
know bad creat object better idea,code/design_debt
fixm clone generat,code/design_debt
todo use generat,code/design_debt
fixm attribut use deprec,code/design_debt
defer argument check,code/design_debt
defer argument check,code/design_debt
defer argument check,code/design_debt
todo think need make sure key actual clone wherea paint instanc alway immut theyr,requirement_debt
fixm draw outlier,requirement_debt
todo think need make sure key actual clone wherea stroke instanc alway immut theyr,requirement_debt
implement,requirement_debt
return string repres week week 2002 todo look internationalis return string repres week,requirement_debt
fixm show dialog error,requirement_debt
fixm show dialog error,requirement_debt
todo draw interv marker effect,requirement_debt
todo add serial support imag,requirement_debt
could make configur,requirement_debt
todo see need appli line color style axi trace,requirement_debt
todo draw interv marker effect,requirement_debt
implement,requirement_debt
fixm implement,requirement_debt
annot allow imag place locat link xyplot todo implement serial proper imag serializ,requirement_debt
plot field test,test_debt
basic ignor protocol let someon report,code/design_debt
sss fixm correct,code/design_debt
fixm use block implement end node need proc captur enclos scope forblock repres node renam,code/design_debt
sss fixm order correct poll next,code/design_debt
use high uncommon string repres paragraph delimit 100 soln worth,code/design_debt
add self recv todo right,code/design_debt
todo mri behavior call add depend call lead except float ad see httpbladenagaokautacjpcgibinscatrbrubyrubycore17374 return callcoercedcontext true mri behavior well use thus provid abil add float,code/design_debt
sss fixm correct place end loop iter,code/design_debt
todo rubi reus logic write behavior check call write,code/design_debt
sss fixm msetlinepositionarraynodegetposit,code/design_debt
would nice logic expon form behav like decim form behav like luck henc,code/design_debt
sss fixm get normal compil initi way sss fixm parentsupertyp info incorrect placehold need updat real class object later,code/design_debt
todo notallocatablealloc probabl confirm jruby415,code/design_debt
sss fixm could make irloop scope semant scope function sure requir yet,code/design_debt
cover rare case lowercas class name thus fail 99999 time fortun well per packag name serious folk look best practic,code/design_debt
sss fixm string liter string dummi class script,code/design_debt
todo deprec effici intern deal rubyhash direct,code/design_debt
sss fixm int suffic need long,code/design_debt
modul includ shim class must find shim handl super appropri,code/design_debt
reset valu map instruct startend basic block right call consid hard boundari optim inform cannot propag across sss fixm rather treat call broad brush need captur differ attribut call use closur known call target modifi scope etc inform probabl alreadi present ast inspector,code/design_debt
todo determin whether perhap store nonsingleton class implementationclass,code/design_debt
sss fixm correct closur arg come,code/design_debt
fixm consid fix nodeassign rather singl case,code/design_debt
sss fixm refer irloop retri,code/design_debt
temporari hack handl nonrubi valu come better solut short,code/design_debt
simplifi variabl keep variabl sync actual use claus requir correct reason perform reason,code/design_debt
must call main thread current bother,code/design_debt
con fixm dont know make case expressiondo logic need,code/design_debt
fixm legal may want unsupportedoperationexcept,code/design_debt
fixm ugli hack resolv jruby1381 proud,code/design_debt
someth wrong dont know cwd todo behavior realli desir mov,code/design_debt
todo java stringiti,code/design_debt
fixm total hack get flash rail marshallingunmarshal session okw need total chang marshal work overridden core class,code/design_debt
todo method present mri,code/design_debt
fixm ideal javaobject instanc marshal mean javaobject metaclass appropri alloc jruby414,code/design_debt
todo public,code/design_debt
fixm probabl translat rubi prioriti level java prioriti level green thread,code/design_debt
todo consid better way synchron,code/design_debt
use ioinputstream may perform way easi,code/design_debt
fixm regener,code/design_debt
xxx check previous use callmethod check equal class scan hierarchi howev check may safe ever one instanc bound given typeconst found unsaf examin way avoid call,code/design_debt
todo notallocatablealloc probabl confirm jruby415,code/design_debt
todo duplic constant fileconst fileconst includ,code/design_debt
clone method belong new class set todo make dynamicmethod immut,code/design_debt
todo miss handl elsewher,code/design_debt
todo cach,code/design_debt
fixm wtf would use class,code/design_debt
todo figur happen possibl remov,code/design_debt
fixm dont like,code/design_debt
fixm descript probabl move constantin project deal platformdepend constant,code/design_debt
fixm temporari much safer cow prevent share string begin allow bytelistset begin awar,code/design_debt
todo arg,code/design_debt
fixm think chunk equival mri id2nam public method id2nam make method use,code/design_debt
todo cach,code/design_debt
fixm probabl effici sinc load method call,code/design_debt
hack replac usual readlin,code/design_debt
get found match method use todo choos narrowest method continu search,code/design_debt
todo kinda gross,code/design_debt
fixm order thread play well standard new behavior must provid alloc creat empti object instanc initi fill appropri data,code/design_debt
extra array realli unfortun split path elimin,code/design_debt
clone dynam scope new instanc block previous captur instanc block may still around want start overwrit valu creat new one enebo make self lastclass lastmethod immut remov duplic,code/design_debt
todo protect method go requir rework mechan,code/design_debt
overload add method guess signatur use todo ad first one right nowadd signatureguess logic,code/design_debt
sss fixm never get call constant svalu,code/design_debt
todo version better hackish previous one window behavior need defin though suppos version could improv todo etcpasswd also inadequ macosx sinc use etcpasswd regular user account,code/design_debt
fixm there code duplic rubyobjectinspect,code/design_debt
visibl check without requir frame self todo dont bother pass fcall vcall adjust callsit appropri,code/design_debt
fixm figur get null sometim,code/design_debt
hacki advanc posit eat newlin,code/design_debt
need reexamin,code/design_debt
fixm current problem iooutputstream write bare runtim without proper scope,code/design_debt
workaround jruby4149,code/design_debt
use iooutputstream may perform way easi,code/design_debt
ignorebean doesnt get regist todo bother,code/design_debt
todo notallocatablealloc probabl confirm jruby415,code/design_debt
enebo lot optz parser,code/design_debt
fixm move class,code/design_debt
fact probabl rais error yes,code/design_debt
todo arysortcheck done,code/design_debt
todo get rid lax return strict throw,code/design_debt
bit riski someon chang completor use method call,code/design_debt
todo rest thisseek posit unnecessari sinc share channel may need,code/design_debt
todo right thing,code/design_debt
fixm probabl belong differ packag,code/design_debt
fixm effici,code/design_debt
clone dynam scope new instanc block previous captur instanc block may still around want start overwrit valu creat new one enebo make self lastclass lastmethod immut remov duplic,code/design_debt
gross java api arent iso 8601 compliant,code/design_debt
todo correct,code/design_debt
workaround jruby2326 mri enter product reason,code/design_debt
creat block iter node fixm shouldnt use current scope actual hierarchi static scope,code/design_debt
sss fixm need check whatev pop,code/design_debt
sss fixm set diff classvardeclnod,code/design_debt
fixm need check mainjava call thisthey consolid,code/design_debt
fixm tabl get move posix librari get actual support signal quick fix support basic signal happen,code/design_debt
fixm worri bit sinc could alloc lot larg newlength,code/design_debt
todo filter kind grossit would nice get parser help,code/design_debt
todo decompos getjavapackagemodul dont pars fullnam,code/design_debt
gross java api arent iso 8601 compliant,code/design_debt
fixm get rid lazi handl restrict access elsewher,code/design_debt
todo use faith reimplement mris algorithm use utf8encod facil joni start prefrom utf8 content valid,code/design_debt
dont opt arg start arg assign later crap like def fooa true number fixm start requir arg sinc opt arg may access other rest arg conflict compileroot use indic signatur,code/design_debt
fixm determin real alloc need peopl want extend javaclass want classnewjavaclass abl todo notallocatablealloc probabl sinc dont intend peopl monkey type cant marshal confirm jruby415,code/design_debt
grrr arghh want subclass sunmiscfloatingdecim cant must next line code alreadi done floatingdecim,code/design_debt
fixm realli want declar method includ privateprotect includ superclass method also getdeclar call may throw securityexcept run restrict secur polici,code/design_debt
small hack save cast later,code/design_debt
perhap inneffici timewis optim spacewis,code/design_debt
todo confirm expect arg irubyobject similar,code/design_debt
there compel reason keep javaclass instanc weak map proxi creat kept nonweak map case stick around anyway good reason javaclass creation expens one mani lookup perform pass paramet tofrom method etc todo faster custom concurr map,code/design_debt
todo check java reserv name rais except encount,code/design_debt
fixm jruby3188 end condit return nullquick fix dig,code/design_debt
workaround bug sun jdk 15x see httpbugssuncombugdatabaseviewbugdobugid6303753,code/design_debt
fixm weakrefrb also caller2 backtrac,code/design_debt
fixm remov grammar,code/design_debt
todo perhap coincid channel rais instanceof selectablechannel sinc stdio notso bother slight con,code/design_debt
fixm sure semant transfer cfiberdefinefastmethodtransf cbgetfastoptmethodtransf,code/design_debt
fixm pretti gross cleaner initi doesnt depend packagevis field ideal atom probabl use immut structur replac lazi null group defin,code/design_debt
dummi scope find way make explicit,code/design_debt
fixm resolv hell go,code/design_debt
rbobjid return intern object fixm renam match rubi name,code/design_debt
shouldnt happen todo might want throw except instead,code/design_debt
fixm mayb best place move good home,code/design_debt
todo notallocatablealloc may unclear struct work marshal confirm behavior ensur correct jruby415,code/design_debt
todo next return also catch,code/design_debt
alway prepend orgjrubyproxi packag begin java javax packag protect sign jar prevent generat new class packag name see jruby2439,code/design_debt
todo abl optim quit bit post10 javaclass alreadi method organ method name next version support protect methodsfield organ even collectmethod lookup overridden method javaclass map much faster,code/design_debt
index item could probabl effici bail assign arg past end,code/design_debt
todo make effici creat irubyarray,code/design_debt
rbmodremovecvar fixm good reason two ident method removeclassvari,code/design_debt
dupsetup rbcopygenericivar dupsetup unlik,code/design_debt
dont opt arg start arg assign later crap like def fooa true number fixm start requir arg sinc opt arg may access other rest arg conflict compileroot use indic signatur,code/design_debt
singlearg contain array know real liter array fixm gross way figur parser help similar yield argument pass expandargu would better,code/design_debt
todo setaccess account pattern found access constant includ nonpubl interfac aka javautilzipzipconst implement mani class,code/design_debt
intend call direct user privat old todo rubi code implement javaclassjava check reserv rubi name conflict method etc,code/design_debt
fixm dont allow multipl thread,code/design_debt
todo bleed runtim parser ariti may parser keep bleed oneway,code/design_debt
rbarypushm fixm whis name pushm,code/design_debt
todo probabl isnt best hack work differ root frame setup easili,code/design_debt
todo least parsersupportattrset pass argsnod null implicitnil wrong magic setuparg sinc irubyobject nil need figur nice fast null pattern setuparg assert argsnod null receivernod null,code/design_debt
hack order stdouterr act like ttys flush alway set anyth assign stdoutstderr sync,code/design_debt
fixm effici,code/design_debt
todo peopl extend gzipwriterread break find better way,code/design_debt
fixm set call configur,code/design_debt
