text,classification
todo first implement call buildpopop extract contain action toolbar built structur toolbar display left jlist label,requirement_debt
todo implement remain support type,requirement_debt
todo implement remain support type,requirement_debt
todo need uml equival,requirement_debt
todo gone uml,requirement_debt
todo unfinish implement,requirement_debt
eclips uml2 implement xmiwrit todo need facil write read stabl id tofrom either xmiid xmiuuid author tom morri,requirement_debt
todo buildcreat method need undo support tfm,requirement_debt
todo bob say autogener list,requirement_debt
need,requirement_debt
todo correct implement next function model subsystem issu 1942,requirement_debt
todo need uml equival,requirement_debt
need,requirement_debt
need,requirement_debt
need,requirement_debt
need,requirement_debt
todo correct implement next function model subsystem issu 1942,requirement_debt
need,requirement_debt
need,requirement_debt
need,requirement_debt
need,requirement_debt
need,requirement_debt
need,requirement_debt
todo updat model per charact basi well unregisteringreregist event listen everi charact wast tfm,requirement_debt
languag must uniqu select current empti languag todo alert,requirement_debt
need,requirement_debt
properti comboboxmodel depict chang uml model method make sure chang done comboboxmodel equal todo function yet complet written inheritdoc see javabeanspropertychangelistenerpropertychangejavabeanspropertychangeev,requirement_debt
need,requirement_debt
need,requirement_debt
todo review tool tip stringfieldsettooltiptexttranslatorlocalizelabelbodytooltip,requirement_debt
need,requirement_debt
list object shown combobox todo use list forc linear search tri add new element model slow larg model,requirement_debt
need,requirement_debt
panel show valu specif uml element todo need implement changelisten yes cant use without option class option dont need,requirement_debt
need,requirement_debt
todo els alert,requirement_debt
todo enhanc isvalidnamespac function never happen,requirement_debt
need,requirement_debt
need,requirement_debt
todo remov region reset overal size node,requirement_debt
todo gone uml,requirement_debt
todo implement,requirement_debt
todo implement,requirement_debt
todo complet,requirement_debt
handl empti target list probabl wizstep show empti pane case,requirement_debt
todo namespac use wfrs,requirement_debt
todo work defer actual need display,requirement_debt
todo anyth allow current diagram,requirement_debt
todo expect associ end check care tfm,requirement_debt
todo done yet eventu also feed ration log,requirement_debt
todo remov uml2,requirement_debt
todo implement,requirement_debt
need,requirement_debt
todo need chang support multipl user model,requirement_debt
todo 2nd next singl hasnext,requirement_debt
todo fulli implement,requirement_debt
todo implement follow wfr generalizableel parent must includ namespac generalizableel selfgeneralizationforallg selfnamespaceallcontentsincludesgpar return modelmanagementhelpermdrimplgetcontentsnscontain gengetpar,requirement_debt
todo i18n,requirement_debt
need,requirement_debt
todo allow realli check templateparameterdefaultel defin,requirement_debt
todo implement,requirement_debt
need,requirement_debt
need,requirement_debt
need,requirement_debt
need,requirement_debt
identifi addon changeabl todo note uml2 version,requirement_debt
need,requirement_debt
need,requirement_debt
need,requirement_debt
need,requirement_debt
need,requirement_debt
need,requirement_debt
need,requirement_debt
need,requirement_debt
need,requirement_debt
need,requirement_debt
need,requirement_debt
need,requirement_debt
todo correct implement next function model subsystem issu 1942,requirement_debt
make readon copi listen list reentrant call back addremovelisten wont mess todo potenti perform issu need correct tfm,requirement_debt
todo review caller make sure local titl process harold braun 20070912,requirement_debt
todo i18n,requirement_debt
need,requirement_debt
need,requirement_debt
need,requirement_debt
need,requirement_debt
need,requirement_debt
need,requirement_debt
need,requirement_debt
need,requirement_debt
need,requirement_debt
todo default constructor delet set dirti flag,requirement_debt
todo super constructor take graphmodel,requirement_debt
todo i18n,requirement_debt
need,requirement_debt
todo get project necessari context sourc egetsourc,requirement_debt
need,requirement_debt
need,requirement_debt
need,requirement_debt
need,requirement_debt
todo make effici larg io,requirement_debt
todo i18n,requirement_debt
need,requirement_debt
need,requirement_debt
need,requirement_debt
todo i18n,requirement_debt
todo bob say autogener list,requirement_debt
todo fail resolv url signal error,requirement_debt
todo countreport unresolv refer,requirement_debt
need,requirement_debt
need,requirement_debt
need,requirement_debt
need,requirement_debt
need,requirement_debt
todo implement support multipl taggedvalu,requirement_debt
need,requirement_debt
need,requirement_debt
need,requirement_debt
todo treat messag,requirement_debt
todo implement,requirement_debt
todo would null,requirement_debt
todo treat messag,requirement_debt
todo rework use uml tagdefinit tfm,requirement_debt
todo need undo support,requirement_debt
todo linear search list contain mani thousand item one everi fig entir project,requirement_debt
todo check liter adapt nsuml,requirement_debt
fix set applic name mac,requirement_debt
todo kind action,requirement_debt
todo use svgwriter2d implement cmd new savesvgaction2translatorlocalizeactionsavesvg,requirement_debt
appar method never call,requirement_debt
todo implement yet idea problem identifi critic fix certain design manipul transform appli automat resolv problem method repli true iff given problem fix fixit method actual fix see orgargoumlcognitivepostercanfixitorgargoumlcognitivetodoitem also see criticfixit,requirement_debt
todo implement yet given todoitem fix automat user want happen obvious depend specif critic problem default method noth param item todo item param arg design materi,requirement_debt
list checkliststatus index model element todo use weak refer forgotten object remov,requirement_debt
todo mayb except string internation,requirement_debt
todo understand qualifi,requirement_debt
todo convert sensibl log,requirement_debt
todo possibl use one variabl,requirement_debt
repli todoitem design see iff predic return true default fill field todoitem accessor method critic critic subclass may overrid method accessor method add comput field todoitem todo critic may want add new field todoitem make stillvalid effic see criticcritiqu param offend param dsgr design return todoitem,requirement_debt
todo implement,requirement_debt
todo remov uml,requirement_debt
categorygetrootgetloggerrepositorysetthresholdleveloff todo find proper implement javautillog api,requirement_debt
todo review caller make sure local titl,requirement_debt
remov listen eventtyp pair listen list todo replac listen implement eventlistenerlist better perform param event event listen listen param listen listen remov,requirement_debt
check offendersp call constructor offend given todo care check first offend param off offend,requirement_debt
need,requirement_debt
todo linear search list contain mani thousand item one everi fig entir project,requirement_debt
todo check,requirement_debt
todo test coverag createproppanel tfm,test_debt
todo test infix oper 847 even though yet support,test_debt
uml 211 metamodel mof cmof model want node tagownedmemb attribut xmitypecmofclass todo code untest tfm,test_debt
modul would useful abl remov factoriesp todo effect method yet test param factori factori remov,test_debt
todo use assert dont want chang illegalstateexcept lead releas dont know much test done assert,test_debt
test constructor use load profil jar file todo test fignod throw except someth goe wrong,test_debt
modelel abstract creat test todo add relev test,test_debt
need add test follow aggregationkind changeablekind messagedirectionkind orderingkind parameterdirectionkind pseudostatekind scopekind visibilitykind,test_debt
todo test generat string correct,test_debt
test list namespac defin getvalidnamespaceclass contain valid namespac todo test test anyth realli,test_debt
cleanallextentsbutmodel todo caus crash,test_debt
todo need work test creation oper select author jaapbranderhorstxs4allnl sinc jan 2003,test_debt
todo requir test run assert enabl isnt guarante environ,test_debt
reason listsetequ alloc lot memori well memori least let tri avoid need invok test two previous test decis,test_debt
test diagramset todo test chain set author tom morri base testprojectset michiel,test_debt
todo use assert dont want chang illegalstateexcept lead releas dont know much test done assert,test_debt
todo fix new sequenc diagram test,test_debt
todo rewrit test use reflect uml class code comment sinc septemb 2003,test_debt
test creation collabor diagram todo test creat oper author jaapbranderhorstxs4allnl sinc jan 2003,test_debt
test uml 13xmi file make sure get convert proper todo uml convert current handl xmi throw filenotfoundexcept indic test configur problem throw umlexcept fail open file,test_debt
test list namespac defin getvalidnamespaceclass contain valid namespac todo test test anyth realli,test_debt
applic check avail startup test would expect unix develop correct configur replac assert jre14,test_debt
todo fail doesnt,test_debt
todo write test enumer although yet support,test_debt
test read compress model main verifi correct read andromda profil todo move test argouml base want read also zip file author lmaitr,test_debt
todo test navig associ class 855 even though yet support,test_debt
test need test,test_debt
todo test type conform 844 even though yet support,test_debt
test fire conflict crnameconflict,test_debt
todo remov leftov test cleanallext assert getfacadegetrootelementss,test_debt
enter 0293 prove test need,test_debt
todo requir test run assert enabl isnt guarante environ,test_debt
todo fail chang name associationend pass,test_debt
modul would use abl remov factori todo effect method yet test param factori factori remov,test_debt
todo test,test_debt
todo test generat string correct,test_debt
todo test rang collect definit 8512 even though yet support,test_debt
todo test collect collect 8513 even though yet support question happen collect construct one,test_debt
test creation metatyp todo could add test make sure creat abstract type,test_debt
listen remov event work todo check work new event pump tfm,test_debt
todo need way drive panel xml rather hard code test,test_debt
todo prove work testumlassociationrolebasecomboboxmodel cut see orgargoumlumluiumlcomboboxmodeladdothermodeleventlistenersjavalangobject,test_debt
todo presum relev obj actual model profil ad test isamodelobj isaprofileobj would clarifi go,test_debt
event go explor must pass firstp come uml model via eventadapt interfacep todo case test case object creat without set treemodel linus add test would better creat explor creat todo explorertreenod also listen event diagram follow rule sinc 0152 creat septemb 2003 2313 author alexb,test_debt
todo author fdietz remov use stream,code/design_debt
fixm author karlped proper version html refer,code/design_debt
hack multilin column,code/design_debt
todo author tstich someth,code/design_debt
todo author fdietz i18n,code/design_debt
fixm remov method toolbarpaneaddc,code/design_debt
todo author fdietz i18n,code/design_debt
todo author fdietz i18n,code/design_debt
todo author hubm copi frederik search builder,code/design_debt
real stupid recreat whole list model replac idbas listmodel updat,code/design_debt
todo author karlped extend handl special entiti restorespecialcharact,code/design_debt
transform emailaddress html substituteemailaddressstr tri ignor emailaddress alreadi link ignor link flag set extend function necessari pars text alreadi part html fixm done smarter direct reg expr without manual pars param input text param ignorelink true link tag ignor give wrong result email adress alreadi link use reg expr direct therefor faster return text emailadress transform link,code/design_debt
todo return content encod accord mime part mail,code/design_debt
todo return content type accord mime part mail,code/design_debt
hack support dockabl view titl updat todo replac listen pattern,code/design_debt
todo stop poll thread,code/design_debt
todo author hubm bad icon tag,code/design_debt
todo categoryenumer,code/design_debt
hack start end time 000000000 day event,code/design_debt
regist interest store chang todo depend way around,code/design_debt
todo fix layout look good even there enough inform provid,code/design_debt
todo author fdietz i18n,code/design_debt
fixm ugli cast contactmodel,code/design_debt
todo dont use deprec method,code/design_debt
todo must get poll interv config file,code/design_debt
todo reactiv featur support,code/design_debt
folder children add todo futur tri fetch addit children demand tree dialog open,code/design_debt
todo author fdietz add special entiti accentur char,code/design_debt
todo author waffel encrypt sign dosnt work messag alway encrypt need function know encrypt sign messag thus first encyrpt verifysign messag messag signedencrypt use gnupg extract decrypt bodypart multipartencrypt multipartsign,code/design_debt
transform url html substituteurlstr tri ignor url alreadi link ignor link flag set extend function necessari pars text alreadi part html fixm done smarter direct reg expr without manual pars param input text param ignorelink true link tag ignor give wrong result url alreadi link use reg expr direct therefor faster return text url,code/design_debt
todo author fdietz ensur dont fetch individu header reduc clientserv roundtrip,code/design_debt
bad releas hardocod fix laterright,code/design_debt
todo author fdietz i18n,code/design_debt
todo author fdietz i18n,code/design_debt
hack start end time 000000000 day event,code/design_debt
todo open stream mime part specifi contentid current view mail,code/design_debt
someth wrong,code/design_debt
mayb better leav option dialog make configur xml file anyway,code/design_debt
todo author fdietz i18n,code/design_debt
todo make hack i18n compat,code/design_debt
todo author fdietz i18n,code/design_debt
todo move resourc resourc file,code/design_debt
todo use undoableeditev make realli work,code/design_debt
todo take action ensur signatur valid html,code/design_debt
xxx fire differ thread,code/design_debt
todoadd configur cach size,code/design_debt
command execut search case new result result arriv ensur interest listen notifi insid edt fixm fdietz lock folder current implement todo fdietz creat new command everi provid introduc real parallel search author fdietz,code/design_debt
xxx threadsaf though luck isnt suppos,code/design_debt
todo author fdietz move abstractmessagefold constructor,code/design_debt
todo renam cloc someth appropri clock,code/design_debt
todo author karlped guess right thing get height getdrawingsizegetheight sinc take top bottom margin print object account height seem set correct computepositionands 20030604 karlped,code/design_debt
cant use systemclassload wouldnt work java webstart resourcebundl use intern classload classload given set classload null,code/design_debt
note intent dont rememb intern plugin dont want appear plugin manag current todo improv plugin manag dialog support intern plugin cant remov etc,code/design_debt
fixm calendar,code/design_debt
todo author hubm flag speed entitymanag improv,code/design_debt
cleanup remov port number file,code/design_debt
todo there probabl better way hack,code/design_debt
todo insert find there alreadi menu item action command replac otherwis insert new,code/design_debt
todo author fdietz add import featur,code/design_debt
todo author fdietz i18n,code/design_debt
todo author hubm implement custom menuitem render,code/design_debt
todo author fdietz page use current show first result,code/design_debt
todo author fdietz i18n,code/design_debt
real stupid recreat whole menu model,code/design_debt
todo author fdietz page use current show first result,code/design_debt
todo throw illegalargumentexcept case variabl null,code/design_debt
todo author fdietz associ help button root pane,code/design_debt
fixm like work want element remov content element refer,code/design_debt
author fdietz use shutdownmanag wrong automat also call framemanag also start second shutdown thread lead two parallel shutdown thread sometim configfil etc get mess,code/design_debt
author fdietz hackish way creat search toolbar jtoolbar searchtoolbar new extendabletoolbar,code/design_debt
command use inform provid link defaultcommandrefer execut todo remov iframemedi depend author timo stich tstichuserssourceforgenet,code/design_debt
manual rewrit connect url rewrit databas file creat start directori dont want,code/design_debt
todo fix updateact enableactionsgetcurrentown,code/design_debt
todo author hubm check neccessari remov old filter searchfoldergetfiltergetfilterruleremoveal add filter criteria searchfoldergetfiltergetfilterruleaddc,code/design_debt
todo let attachmentview get focus work,code/design_debt
todo open messag frame todo handl also messag attach openincompos action,code/design_debt
todo author fdietz add central place keep list possibl color provid custom color configur possibl,code/design_debt
todo dont use deprec method,code/design_debt
todo author fdietz implement custom menuitem render,code/design_debt
todo author fdietz i18n,code/design_debt
todo author fdietz i18n,code/design_debt
fixm author fdietz need implement tempfold put empti method like virtualfold,code/design_debt
todo author fdietz i18n,code/design_debt
todo ristretto handl log stream anoth way,code/design_debt
todo author fdietz code creat new imaprootfold move folderfactori way path would handl factori parent directori mail folder exampl columbamail string path mailconfiggetinstancegetconfigdirectorygetpath,code/design_debt
turn focus steal workaround remov futur,code/design_debt
wait activ transact todo author hubm retrycount,code/design_debt
regular express cover anyth aapt aacom aainfo permit usag invalid top domain though bug fdietz ad regular charact examplemailtoplevelmaild todo see replac match code ristretto stuff,code/design_debt
author fdietz workaround general contact dialog editor ensur necessari field avail,code/design_debt
todo replac view detail info view,code/design_debt
todo check need vector better anoth list implement check also list must syncron perform,code/design_debt
fixm correct,code/design_debt
todo author fdietz i18n,code/design_debt
todo extern string nonnls1,code/design_debt
todo multipl check,code/design_debt
todo author fdietz get set updat immedi open messag box tell user restart,code/design_debt
todo real status,code/design_debt
fixm align menu left instead menushowb bgetwidth menugetwidth bgetheight,code/design_debt
todo author fdietz i18n,code/design_debt
todo author fdietz i18n,code/design_debt
author tstich better call shutdownmanag sinc call automat shutdownmanag modifi allow one shutdown call never multishutdown problem,code/design_debt
todo come better name menu item,code/design_debt
todo throw illegalargumentexcept case variabl null,code/design_debt
todo author fdietz page use current show first result,code/design_debt
todo use undoableeditev make realli work,code/design_debt
todo author fdietz add export featur,code/design_debt
todo author fdietz page use current show first result,code/design_debt
sinc columba log handler use handler parent logger,code/design_debt
todo author fdietz i18n,code/design_debt
javahelp cant ad borderlayout isnt compon demo well use embed method sinc dont want frame creat,code/design_debt
author fdietz problem extens dont run use java webstart jws even though assign allpermiss columbajnlp file appli initi java webstart classload creat classload load extens classload dont permiss set anymor,code/design_debt
could start new server,code/design_debt
workaround systemsetsecuritymanagernul call effect disabl sandbox mode seem work fine use anoth way polici classload set allpermiss dont realli know differ though,code/design_debt
mac screenbarmenus work must declar awt swing get initialis move plugin init locat late,code/design_debt
kid dont home,code/design_debt
author fdietz follow line work dont know mainmainclassloaderaddurlsurl urllisttoarraynew url0 workaround modifi system class loader instead horribl work,code/design_debt
author fdietz workaround simpli append url exist global class loader use parent note creat new url classload everi class instanci might want support hotswap chang class later,code/design_debt
todo author fdietz i18n,code/design_debt
cant use systemclassload doesnt work java webstart instead use thisgetclassgetclassload seem work perfect,code/design_debt
todo author karlped exist meta tag kept code chang necessari,code/design_debt
todo creat except,code/design_debt
todo renam cloc someth appropri clock,code/design_debt
todo author javaprog better except handl,code/design_debt
todo author fdietz fix account info panel check,code/design_debt
todo author fdietz move abstractmessagefold constructor creat filterlist datastructur,code/design_debt
todo author fdietz i18n,code/design_debt
todo add javadoc,documentation_debt
fixm function need document return boolean param xmlelement,documentation_debt
fixm function need document return string param string name,documentation_debt
todo author fdietz add proper descript,documentation_debt
fixm function need document constructor,documentation_debt
fixm function need document param outputstream print data,documentation_debt
fixm function need document constructor param name string param data string,documentation_debt
todo creat javadoc class,documentation_debt
fixm function need document param attr hashtabl use attribut,documentation_debt
fixm function need document return xmlelement param string path,documentation_debt
todo add javadoc,documentation_debt
fixm function need document return vector,documentation_debt
fixm function need document return enumer,documentation_debt
fixm function need document return string param string name,documentation_debt
fixm function need document constructor param string name param hashtabl attribut,documentation_debt
fixm function need document constructor param string name,documentation_debt
need,requirement_debt
todo author fdietz replac regular express,requirement_debt
todo implement,requirement_debt
todo author fdietz implement,requirement_debt
todo author fdietz replac regular express,requirement_debt
todo implement valid,requirement_debt
todo implement,requirement_debt
creat subject headerfield use sender messag subject prepend fwd alreadi param header codecolumbaheadercod contain headerfield messag want replyforward fixm author fdietz need i18n,requirement_debt
todo finish marshal avail properti,requirement_debt
todo finish unmarshal avail properti,requirement_debt
todo implement,requirement_debt
todo author fdietz replac regular express,requirement_debt
todo author fdietz implement,requirement_debt
todo implement,requirement_debt
implement yet,requirement_debt
creat subject headerfield use sender messag subject prepend alreadi param header codecolumbaheadercod contain headerfield messag want replyforward fixm author fdietz need i18n,requirement_debt
todo implement,requirement_debt
todo author karlped implement undoredo miss,requirement_debt
html quot done insert div around messag formattet blue line left edg todo author fdietz implement quot font color stylesheet blockquot,requirement_debt
todo author fdietz replac regular express,requirement_debt
todo author fdietz show error dialogher,requirement_debt
todo author karlped implement undoredo miss,requirement_debt
todo author fdietz add error dialog,requirement_debt
todo author fdietz add error dialog,requirement_debt
need,requirement_debt
todo show dialog,requirement_debt
todo author fdietz replac regular express,requirement_debt
todo author fdietz make i18n,requirement_debt
todo author javaprogsizecombobox enabl paragraphcombobox implement,requirement_debt
todo add dialog inform user smtp server support authent,requirement_debt
todo author hubm show alreadi virtual folder tag,requirement_debt
updat status messag todo author fdietz i18n,requirement_debt
todo author karlped implement undoredo miss,requirement_debt
todo author fdietz keep track progress,requirement_debt
todo local filter action name,requirement_debt
todo author fdietz i18n,requirement_debt
todo implement clear,requirement_debt
todo author fdietz implement action font size combo box,requirement_debt
todo author fdietz i18n,requirement_debt
todo local filter action name,requirement_debt
todo author fdietz replac regular express,requirement_debt
fixm threadedview auto collaps,requirement_debt
todo author karlped implement undoredo miss,requirement_debt
todo author fdietz implement test,test_debt
test case generat subject line repli andor forward messag todo recolumbadeveltestsubject author fdietz,test_debt
todo test mac keyboard acceler chang done mlivingston shortcut key,test_debt
fixm miss full test leap year,test_debt
todo fix testcas assertequalsfilt result true result,test_debt
get locat extern commandlin tool todo test method param toolid tool return locat tool,test_debt
todo factor genbaseimpl,code/design_debt
eatm call deprec method thing might overrid older code,code/design_debt
todo factor genbaseimpl,code/design_debt
unus,code/design_debt
todo factor genbaseimpl,code/design_debt
call workaround,code/design_debt
todo deprec sinc getpluginclass longer call,code/design_debt
ensur race condit thread safe doesnt matter win race,code/design_debt
todo factor genbaseimpl,code/design_debt
todo assum get set notif isnt good assumpt,code/design_debt
dms handl well,code/design_debt
unus,code/design_debt
tbd come better algorithm choos default label featur,code/design_debt
