text,classification
build default implement interfac interfac own model element default user forget add ownership return interfac todo need extra paramet specifi modelext new element creat,code/design_debt
check label etc hit appar gef requir pathitem annot arent resolv,code/design_debt
creat empti initi instanc uml templateparamet return initi uml templateparamet instanc todo need extra paramet specifi modelext new element creat,code/design_debt
build default implement class class own model element default user forget add ownership return newli creat class todo need extra paramet specifi modelext new element creat,code/design_debt
creat empti initi instanc uml usag return initi uml usag instanc todo need extra paramet specifi modelext new element creat,code/design_debt
creat empti initi instanc uml permiss return initi uml permiss instanc todo need extra paramet specifi modelext new element creat deprec 0273 tfmorri renam uml packageimport use link createpackageimport,code/design_debt
creat empti initi instanc uml permiss return initi uml permiss instanc todo need extra paramet specifi modelext new element creat,code/design_debt
action add stereotyp model element todo appear unus author bob tarl deprec 0272 tfmorri use link orgargoumlumlactionaddstereotyp,code/design_debt
return destin relat link destin relat defin modelel receiv relat destin first return destin null return exampl sourc includ classifi type associationend usecas base extend includ relat case associ destin defin type second element connect listp todo move method generic modelhelp param relationship relat return object,code/design_debt
return sourc relat link sourc relat defin modelel propag relat sourc first return sourc null return exampl sourc includ classifi type associationend usecas base extend includ relat sourc alway start arrow fig destin endp todo move method generic modelhelp param relationship relat return object,code/design_debt
set languag express todo oper fool user think bodi object chang instead new object creat way mexpress alter creat oper return newli creat object instead param handl express param languag new languag return newli creat object,code/design_debt
todo remov cast diagramfactoryinterface2 soon diagramfactoryinterfac remov,code/design_debt
todo critic action introduc unnecessari depend critic subsystem regist desir action use extens mechan tfm,code/design_debt
true instanc allow invis current set true figedgeport todo figedgeport remov fignodemodelel hierarchi need remov,code/design_debt
todo realli want class packag scope howev reflect,code/design_debt
todo lot lot magic number use calcul posit size time see fig place 1010 use constant instead reliabl interpret calcul factor well add addit constant need express common factor tfm 20081201,code/design_debt
name set empti string yuck default fix,code/design_debt
todo note copypast code figexitpoint code better place gef,code/design_debt
todo remov cast diagramfactoryinterface2 soon diagramfactoryinterfac remov,code/design_debt
find model element modelel name equal name param name name model element find cant null param modelel link collect model element find model element name return model element found null todo mayb move helper class deal model relat stuff,code/design_debt
todo realli set profil instead depend default depend default profil configur contain type integ test proper otherwis get creat main project defeat purpos,code/design_debt
call propertychang detect stereotyp ad remov remov fignod remov listen stereotyp new stereotyp detect add listen todo bob say opinion shouldnt figstereotyp alway listen chang owner name figstereotypescompart alway listen add remov stereotyp owner class need pass event fignod awt thread chang result chang size requir redraw pnote run model mdr thread param event umlchangeev caus chang,code/design_debt
todo want top level packag instead immedi parent,code/design_debt
todo creat depend critic subsystem need generic way modul includ intern subsystem request addit action popup menu tfm 20080430,code/design_debt
templat method call argouml framework result chang model element call method direct poverrid subclass order chang model element fignod listen result chang model pthis method guarante framework run thread model subsystemp todo let refactor time take umlchangeev argument param event umlchangeev caus chang,code/design_debt
todo general extens remov critic specif code,code/design_debt
todo requir would fig alreadi dash see orgtigrisgefpresentationfigedgesetfig orgtigrisgefpresentationfig,code/design_debt
prevent underlin event underlin chang todo gef manag gef 0134 includ,code/design_debt
todo general extens remov critic specif stuff,code/design_debt
shall depend,code/design_debt
todo use follow function dropdown set tool toolbarfactoryadditemstotoolbarbuttonpanel action true instead temporari solut param buttonpanel toolbar param action array action repres tool layout,code/design_debt
todo mvw done gef,code/design_debt
todo use follow function dropdown set tool toolbarfactoryadditemstotoolbarbuttonpanel action true instead temporari solut param buttonpanel toolbar param action array action repres tool layout,code/design_debt
todo shouldnt need reflect convinc everyth getitemuid method implement iitemuid,code/design_debt
todo figur get thrown throw new unsupportedoperationexcept,code/design_debt
constraint code deal supplier per depend todo support see orgargoumlumluiabstractactionaddmodelelementdoitjavautillist,code/design_debt
todo namespac creat event current model think wrong namespac activitygraph vecaddal modelgetmodelmanagementhelpergetallmodelelementsofkind modelgetfacadegetnamespacegettarget modelgetmetatypesgetev,code/design_debt
chang font fig contain given figgroup todo fact design error method class name ital sinc class abstract class featur plain font problem fix implement updatefont method subclass param figgroup chang font,code/design_debt
todo namespac enlist event current model think wrong namespac activitygraph vecaddallmodelgetmodelmanagementhelpergetallmodelelementsofkind modelgetfacadegetnamespacegettarget modelgetmetatypesgetev,code/design_debt
todo move figgroup gef param scb suppresscalcbound set,code/design_debt
todo find way replac depend project,code/design_debt
updat titlelabel mvw overrul icon set initiallli need,code/design_debt
todo function attempt optim generic code parent also work correct case good idea,code/design_debt
creat new checkbox menu item attach specifi action object append end menu todo almost duplic argojmenuaddcheckitem must find way merg param action checkbox menu item ad return new checkbox menu item,code/design_debt
todo temporari crutch use fig updat use constructor accept diagramset object,code/design_debt
todo 21122008 dthompson mouseclickedm consum mous event intern suspect line might necessari,code/design_debt
todo cyclic depend selectionrerouteedg figedgemodelel,code/design_debt
actionaddexistingnod enabl past exist node diagram author eugenio alvarez data access technolog todo class well actionaddexistingnod,code/design_debt
constructor todo name paramet use icon tooltip make i18n tooltip imposs param modeclass next global editor mode param modearg argument new mode param name name command tooltip text,code/design_debt
fix bad fig due error earlier releas argouml happen general without child parent todo move xsl remov graph model write possibl caus concurr modif except param owner,code/design_debt
todo doesnt work reliabl constructor need better way get default fig set own project rather use project manag singleton tfm,code/design_debt
defin method generat sourc code model class provid code generat function must implement recogn argouml code generat todo guiindepend mechan pass set code generat need similar revers engin see link orgargoumlumlrevengimportinterfacegetimportset link orgargoumlumlrevengsettingstyp sinc 020 replac filegener interfac,code/design_debt
todo creat depend critic subsystem need generic way modul includ intern subsystem request addit action popup menu tfm 20080430,code/design_debt
chang font fig contain given figgroup todo fact design error method class name ital sinc class abstract class featur plain font problem fix implement updatefont method subclass param figgroup chang font,code/design_debt
hack dont show first column model element object place,code/design_debt
todo doesnt matter get set gef cant draw anyth except pixel wide line,code/design_debt
todo workaround gef redraw problem forc child fig layer,code/design_debt
look namedel sinc alway name modelel alon,code/design_debt
pdetermin figedg current connect correct fignod edg correct fignod set edg rerout ptypic use user amend properti panel relationship one model element anoth graph need react chang peg particip associ end chang pcall helper method layoutthistoself avoid edg disappear new sourc dest node todo method call far frequent call specif event receiv seem current call whenev event receiv owner return boolean whether updat sucess,code/design_debt
todo class move packag orgargoumlumluibehaviorcommonbehavior,code/design_debt
todo depend cycl fignodemodelel figedgem need introduc remov interfac decoupl,code/design_debt
figmycircl figcircl correct connectionpoint method method calcul connect edg endsp todo gef version 0131m4 whole class remov sinc taken gef,code/design_debt
comput border point ellips edg store upper left corner given parameterp todo gef version 0131m4 method fact whole class remov sinc taken gef revis 1279 param anotherpt remot point edg drawn return connect point boundari ellips,code/design_debt
class display graphic nari associ associ node diamond todo improv locat stereotyp author pepargoumlyahoo,code/design_debt
constructor todo name paramet use icon tooltip make i18n tooltip imposs param modeclass next global editor mode param arg name new argument new mode param valu valu new argument new mode param name name command tooltip text,code/design_debt
todo find better way hard code colour,code/design_debt
todo send event instead call explor direct,code/design_debt
todo find way replac depend project,code/design_debt
set target properti panel given target may either diagram modelel target given fig check made fig own modelel occur current diagram modelel target deprec argouml version 0135 visibl method chang futur replac link orgargoumluitargetmanagertargetmanag todo mvw think deprec param target new target see orgargoumluitabtargetsettargetjavalangobject,code/design_debt
todo need use differ method use constructor want allow method overridden,code/design_debt
todo deleg specialist fignam class,code/design_debt
todo replac magic number constant,code/design_debt
inform sourc unit content whether exist memori store file todo make interfac instead class would allow flexibl deal nonfilebas resourc tfm author aslo,code/design_debt
todo without null check follow throw npe mani time call figedgemodelelementmodelchang need think,code/design_debt
todo manag detailspan targetlisten tfm remov follow line,code/design_debt
todo cant depend projectbrows need get current draw area diagram subsystem gef,code/design_debt
creat main draggabl label associ overridden subclass chang behaviour todo consid introduc figedgemodelel use throughout edg param owner own uml element param set render set,code/design_debt
mvw case move call setselecteditem outsid buildingmodel otherwis combo updat new select see issu 5418,code/design_debt
mvw case move call setselecteditem outsid buildingmodel otherwis combo updat new select probabl appli case,code/design_debt
fig permiss form depend todo uml import access permiss becom packageimport public visibl nonpubl visibl respect argouml support import permiss current friend permiss drop also type hierarchi reorgan packageimport subtyp depend author markus klink,code/design_debt
todo press cancel becom javalangexcept,code/design_debt
action trigger code generat one class fact name class interfac activ diagram generat deliv empti collect select class interfac content select packag generat independ name todo implement logic behaviour,code/design_debt
todo bob say model element name could generat name general becom class class,code/design_debt
hack make sure right height appli icon use,code/design_debt
todo extens may findpanelfortarget panel show,code/design_debt
util function local given string help text show status bar argouml window function use favour inlin call enabl later improv would possibl show helpballoon todo code also present root fig param given string local shown,code/design_debt
add concurr region concurr composit state action execut either composit concurr state select one concurr region todo move magic number constant author pepargoumlyahoo,code/design_debt
todo improv extens,code/design_debt
todo make magic number configur,code/design_debt
helper method changeconnectednod todo probabl superclass associ sever diagram type,code/design_debt
return current target deprec argouml version 0135 visibl method chang futur replac link orgargoumluitargetmanagertargetmanagergettarget targetmanagergetinstancegettarget todo mvw think deprec return target see orgargoumluitabtargetgettarget,code/design_debt
rerout connect old node connect new node deleg reroutexxx possibl edg class diagram associ depend general link todo probabl superclass mani fig sever diagram type param newnod new node one end drag param oldnod exist node alreadi connect param edg edg draggedrerout param issourc tell end rerout,code/design_debt
todo cyclic depend selectionrerouteedg figedgemodelel,code/design_debt
prevent bold event bold chang todo gef manag gef 0134 includ,code/design_debt
see javaawteventactionlisteneractionperformedjavaawteventactionev todo combobox javadoc method public implement side effect call overrid find way implement,code/design_debt
todo shouldnt know specif type fig display coupl strong thing shouldnt need know tfm 20070924,code/design_debt
todo temporari method make sure model updat loss focus combo box long term attempt updat model keypress see javaawteventfocuslistenerfocuslostjavaawteventfocusev,code/design_debt
model tabl tag valu implement uml tagdefinit todo current support taggedvalu tagdefinit type string,code/design_debt
todo use extens registr mechan intern class well everyth treat,code/design_debt
todo realli pass default set diagram factori get set creation time,code/design_debt
idem general leafroot object todo show messag statusbar would help todo illegalargumentexcept use event expect happen need differ way catch wellformed rule,code/design_debt
connect method specifi connect type class unavail argouml implement todo unsupport use object version inheritdoc,code/design_debt
todo wed like fill gef wont let select setfilledfals,code/design_debt
gef method todo realli pick automat gef interfac extend thing note weve ad method use argouml possibl extern consum need method,code/design_debt
abstract class parent action ad diagram argouml children class implement creatediagram specif action creat diagram isvalidnamespac check namespac valid add diagram argouml shall never creat diagram readon modelelementp todo class merg actionnewdiagram author jaapbranderhorstxs4allnl,code/design_debt
todo mvw complet sure followingp namespac diagram use creat new element shown diagram namespac set accord necessarili equal owner return namespac diagram,code/design_debt
todo use default valu appropri type,code/design_debt
set fig style accord attribut todo never use remov param fig fig style param attributemap map name valu pair,code/design_debt
hang head shame still bug argouml andor gef caus corrupt model save take place repair model order certain possibl save file reload todo split small inner class fix return text explain repair,code/design_debt
todo refer method orgargoumlumluivetoablepropertychangegetvetomessagestr class exist anymor method never use param propertynam name properti return messag null applic,code/design_debt
execut action command line todo under gef librari reli acm doesnt allow creat file unless window show reason split perform command link orgargoumlapplicationmainmainstr suppli batch option run command window show hope eventu fix see orgargoumlapplicationapicommandlineinterfacedocommandstr param argument file name save return true,code/design_debt
todo make explor listen project member properti chang elimin coupl gui,code/design_debt
todo associationclass fit next case,code/design_debt
need,code/design_debt
todo probabl use instead legaci uml code tfm 20070915,code/design_debt
see javabeanspropertychangelistenerpropertychangejavabeanspropertychangeev todo review see improv view toward remov overrrid method use workaround differ nsuml mdr tfm 20060302,code/design_debt
see javabeanspropertychangelistenerpropertychangejavabeanspropertychangeev todo review see improv view toward remov overrrid method use workaround differ nsuml mdr tfm 20060302,code/design_debt
todo font shouldnt handl differ render attribut,code/design_debt
todo one send deprec event outsid argouml keep respond case,code/design_debt
forward event tree model param element modelel ad todo shouldnt public compon desir inform explor chang send event,code/design_debt
todo need know projectset tfm,code/design_debt
todo cant use actionaddexistingnod bob,code/design_debt
todo wed like test new guis packageimport dont good way current,code/design_debt
constraint code deal supplier per depend todo need see orgargoumlumluiabstractactionaddmodelelementdoitjavautillist,code/design_debt
todo make explor listen project member properti chang elimin coupl gui,code/design_debt
abstract action trigger creation new diagram argouml shall never creat diagram readon modelel todo bob say merg actionadddiagram class author michiel,code/design_debt
first let set duplic hash hash contain duplic key anoth key todo everi duplicateput done twice avoid,code/design_debt
todo get contain project list target global,code/design_debt
todo bob say realli nasti horribl hack shadowfig extend fignodemodelel instead requir base class fignod common behaviour node argouml shadowfig extend fignodemodelel extend base class ad common function fignod repres model element see orgargoumlumldiagramuifignodemodelelementsetshadowsizeint,code/design_debt
window display except user cant handl way todo part convert generic error dialog rather someth specif except renam process complet,code/design_debt
todo dont use hardcod color tfm,code/design_debt
todo wont use pathcompar take care uniqu,code/design_debt
author jaapbranderhorstxs4allnl sinc jan 2003 todo uml need chang toggl repres readon frozen changeabl,code/design_debt
save project param file file save param pmw progressmonitor updat return true success todo separ swing specif class tfm,code/design_debt
work progress allow multipl detail pane differ content bob tarl,code/design_debt
todo fire event projectbrows regist listen,code/design_debt
todo follow mdr specif need someth generic model subsystem tfm 20070716,code/design_debt
main class gui subsystemp user gui subsystem compon place gui compon regist classp todo add rest regist author linus tolk sinc 0213,code/design_debt
constructorp todo constructor use purpos param name local param sub rule,code/design_debt
todo follow mdr specif need someth generic model subsystem tfm 20070716,code/design_debt
todo shouldnt need reflect convinc everyth setitemuid method implement iitemuid,code/design_debt
todo support nest let express,code/design_debt
need commentedg todo doesnt commentedg implement iitemuid handl mechan,code/design_debt
set directori name profil found initi uml14 use todo intermedi solut uml support pleas implement better solut param dir name directori profil,code/design_debt
todo wrong place profil specif need move main xmi read code tfm 20060326,code/design_debt
made public allow other extend persist,code/design_debt
edg connect comput rout make sure annot edg port posit correct edg connect comput rout requir edg connect node todo would nice restor annot posit instead,code/design_debt
todo move gef,code/design_debt
todo move gef,code/design_debt
param project argouml link project save file param file link file argouml link project persist return persist use usabl file throw saveexcept save file goe wrong throw interruptedexcept interrupt occur save todo move helper class,code/design_debt
todo whole class need updat remov use deprec method hope test multiroot multiproject method sinc nov 2002 author jaapbranderhorstxs4allnl,code/design_debt
method assign data immedi see end file todo ever want extend pathitemplac modifi also recognis subclass pathitemplac class name pathitemplac todo use class refer make depend obvious,code/design_debt
todo cyclic depend actionstereotypeview fignodemodelel regist action opaqu sinc dont tfm,code/design_debt
todo care,code/design_debt
todo break main member type model diagram,code/design_debt
get link abstractfilepersist file param file link file argouml link project persist return appropri persist file null file extens doesnt match support persist todo move helper class,code/design_debt
find type model name fixm duplic method name orgargoumlprofileinternalmodelutil param type name param model model return type codenullcod type found,code/design_debt
class manag project load argouml current project class argouml ask class current project set current project sinc one project argouml moment class manag list project like one would expect could nice extens futur argouml soon current project chang properti chang event fire todo move everyth relat creation project projectfactori sinc nov 2002 author jaapbranderhorstxs4allnl stereotyp singleton,code/design_debt
todo use place diagram need stay projectset well diagramset return return codetruecod show stereotyp explor,code/design_debt
throw saxexcept thing wrong sax throw ioexcept there error throw parserconfigurationexcept parser find wrong syntax todo unus,code/design_debt
sinc hope temporari solut nobodi ever look type notat event simplifi send everi exist event one event sinc catchal event defin make one rational reduc number total refresh draw,code/design_debt
prefix identifi implement specif class todo general doesnt chang time new implement creat tfm 20051109,code/design_debt
todo temporari need new list uml follow uml element uml,code/design_debt
todo current mechan merg test generic model test nsuml test need review merg author eului sinc 0192 version 000,code/design_debt
find classifi certain namep return first classifi match name todo move model subsystem tfm 20070307 param short name param namespac search return found classifi codenullcod found,code/design_debt
uml packag structur entir differ remap bunch stuff name without embed colon indic entir packag remap kernelcor matter fact packag get renam move usecas todo section incomplet tfm,code/design_debt
set uri project dont use direct use instead link orgargoumlpersistencepersistencemanag setprojecturiuri project todo isnt deprec privat use param theuri uri set,code/design_debt
todo projectbrows doesnt need mediat convers use event listen todopan communic instead tfm,code/design_debt
project interfac encapsul inform design project contain list diagram uml model various project properti author name default various set todo interfac mechan refactor implement class link projectimpl need review clean elimin method part public api split interfac smaller function specif trashcan interfac author tom morri tfmorrisgmailcom thoma neustupni sinc 0254 replac concret class name,code/design_debt
todo listen new target event fire wizstepupdatetabtodo decoupl projectbrows,code/design_debt
todo fire event projectbrows todo regist listen,code/design_debt
agenc manag critic sinc class realli first class object java singleton instanc agenc made pass around need agenc keep registri critic appli type design materi design materi instanc critiqu ask agenc appli regist critic current scheme thread proactiv continu critiqu design hand even user idl simpl work disadvantag activ critic relat given design materi appli regardless reason critiqu lot cpu time basic wast todo move toward reactionari scheme specif design manipul editor caus critic relev manipul appli transit still half done trigger critiqu request code trigger current dormant latentp todo strong depend cycl agenc design either need merg singl class partit differ perhap use interfac break cycl design singleton get pass almost everi singl part critic subsystem creat strong coupl throughout tfm 20070620 author jason robbin,code/design_debt
repli true iff critic relev goal design tri achiev default critic relev regardless goalmodel realli someth controlmech comput subclass critic encapsul inform may need overrid method todo would like better default action goal type valu must interpret critic generic decisionmodel param dsgr design return true relev,code/design_debt
todo hack much better way would start critic first place,code/design_debt
return true iff given todoitem still valid kept given design todolist critic enabl alway return fals todoitem remov subclass critic suppli multipl offend alway overrid method default method basic ask critic critiqu offend object check result todoitem one alreadi post simpl work fine lightweight critic critic expend lot comput effort make feedback easili check see still hold overrid method todo mayb todoitem carri data make method effici inheritdoc,code/design_debt
decisionmodel part state design describ type decis design issu design think current time critic relev decis made activ critic relev made inact todo notion decis certain importan certain time follow dont good exampl quantifi import decis todo right individu decis string mayb nonatom structur author jason robbin,code/design_debt
much control critic relav code instead declar limit reason use semant rich method call impact component,code/design_debt
